{
  "batch_id": "00000000-0000-4000-8000-000000000005",
  "family_member_id": "00000000-0000-4000-8000-000000000004",
  "items": [
    {
      "attempts": 1,
      "document_kind": "policy",
      "display_label": "Sample policy document A.pdf",
      "error_code": null,
      "ocr_pages_processed": 2,
      "ocr_state": "completed",
      "ocr_warning_codes": [],
      "source_id": "aaaaaaaaaaaaaaaaaaaaaaaaaaaaaaaaaaaaaaaaaaaaaaaaaaaaaaaaaaaaaaaa",
      "state": "succeeded"
    },
    {
      "attempts": 1,
      "document_kind": "terms",
      "display_label": "Sample policy document B.pdf",
      "error_code": "PASSWORD_REQUIRED",
      "ocr_pages_processed": 0,
      "ocr_state": "pending",
      "ocr_warning_codes": [],
      "source_id": "bbbbbbbbbbbbbbbbbbbbbbbbbbbbbbbbbbbbbbbbbbbbbbbbbbbbbbbbbbbbbbbb",
      "state": "password_required"
    }
  ],
  "schema_version": "1",
  "state": "partial"
}
